DRG_code;description;cost;ALOS
Π44Χ;Φλεγμονώδης νόσος εντέρου χωρίς  συνυπάρχουσες παθήσεις - επιπλοκές;10730.0;2
Π45Μ;Απόφραξη γαστρεντερικού συστήματος με καταστροφικές ή σοβαρές  συνυπάρχουσες παθήσεις - επιπλοκές;13380.0;7
Π45Χ;Απόφραξη γαστρεντερικού συστήματος χωρίς καταστροφικές ή σοβαρές  συνυπάρχουσες παθήσεις - επιπλοκές;6230.0;3
Π46Α;Κοιλιακός πόνος ή μεσεντερική αδενίτιδα;3270.0;2
Π47Μ;Οισοφαγίτιδα και γαστρεντερίτιδα με καταστροφικές ή σοβαρές  συνυπάρχουσες παθήσεις - επιπλοκές;11210.0;5
Π47Χ;Οισοφαγίτιδα και γαστρεντερίτιδα χωρίς καταστροφικές ή σοβαρές  συνυπάρχουσες παθήσεις - επιπλοκές;3350.0;2
Π50Μ;Διάγνωση άλλων παθήσεων του πεπτικού συστήματος με καταστροφικές ή σοβαρές  συνυπάρχουσες παθήσεις - επιπλοκές;11360.0;6
Π50Χ;Διάγνωση άλλων παθήσεων του πεπτικού συστήματος χωρίς καταστροφικές ή σοβαρές  συνυπάρχουσες παθήσεις - επιπλοκές;3740.0;2
Η01Μ;Αναστομώσεις πυλαίας-κάτω κοίλης, επεμβάσεις παγκρέατος, ήπατος και παρακάμψεις με καταστροφικές  συνυπάρχουσες παθήσεις - επιπλοκές;79160.0;19
Η01Χ;Αναστομώσεις πυλαίας-κάτω κοίλης, επεμβάσεις παγκρέατος, ήπατος και παρακάμψεις χωρίς καταστροφικές  συνυπάρχουσες παθήσεις - επιπλοκές;36820.0;7
Η02Μα;Μείζονες επεμβάσεις χοληφόρων  με καταστροφικές  συνυπάρχουσες παθήσεις - επιπλοκές;51110.0;17
Η02Μβ;Μείζονες επεμβάσεις χοληφόρων  με σοβαρές  συνυπάρχουσες παθήσεις - επιπλοκές;25780.0;9
Η02Χ;Μείζονες επεμβάσεις χοληφόρων  χωρίς καταστροφικές ή σοβαρές  συνυπάρχουσες παθήσεις - επιπλοκές;20790.0;6
Η05Μ;Διαγνωστικές ηπατοχολικές παρεμβάσεις με καταστροφικές  συνυπάρχουσες παθήσεις - επιπλοκές;45330.0;14
Η05Χ;Διαγνωστικές ηπατοχολικέςπαρεμβάσεις χωρίς καταστροφικές  συνυπάρχουσες παθήσεις - επιπλοκές;13930.0;4
Η06Μ;Λοιπές Διαγνωστικές ηπατοχολικές χειρουργικές παρεμβάσεις και παρεμβάσεις  παγκρέατος με καταστροφικές  συνυπάρχουσες παθήσεις - επιπλοκές;46460.0;19
Η06Χ;Λοιπές Διαγνωστικές ηπατοχολικές χειρουργικές παρεμβάσεις και παρεμβάσεις παγκρέατος χωρίς καταστροφικές  συνυπάρχουσες παθήσεις - επιπλοκές;15560.0;5
Η07Μ;Ανοιχτή χολοκυστεκτομή με κλειστό χοληδόχο πόρο ή με καταστροφικές  συνυπάρχουσες παθήσεις - επιπλοκές;42990.0;14
Η07Χ;Ανοιχτή χολοκυστεκτομή χωρίς κλειστό χοληδόχο πόρο χωρίς καταστροφικές  συνυπάρχουσες παθήσεις - επιπλοκές;20370.0;6
Η08Μ;Λαπαρασκοπική χολοκυστεκτομή με κλειστό χοληδόχο πόρο ή με καταστροφικές ή σοβαρές συνυπάρχουσες παθήσεις - επιπλοκές;21110.0;6
Η08Χ;Λαπαρασκοπική χολοκυστεκτομή χωρίς κλειστό χοληδόχο πόρο χωρίς καταστροφικές ή σοβαρές  συνυπάρχουσες παθήσεις - επιπλοκές;12730.0;2
Η20Μ;Ενδοσκοπικές επεμβάσεις για αιμορραγία κιρσων του οισοφάγου με καταστροφικές  συνυπάρχουσες παθήσεις - επιπλοκές;35610.0;11
Η20Χ;Ενδοσκοπικές επεμβάσεις για αιμορραγία κιρσων του οισοφάγου χωρίς καταστροφικές  συνυπάρχουσες παθήσεις - επιπλοκές;15170.0;5
Η23Μ;Ενδοσκοπική παλίνδρομη χολαγειοπαγκρεατογραφία με καταστροφικές ή σοβαρές  συνυπάρχουσες παθήσεις - επιπλοκές;25520.0;11
Η23Χ;Ενδοσκοπική παλίνδρομη χολαγειοπαγκρεατογραφία χωρίς καταστροφικές ή σοβαρές  συνυπάρχουσες παθήσεις - επιπλοκές;7860.0;3
Η40Μα;Κίρρωση και αλκοολική ηπατίτιδα με καταστροφικές  συνυπάρχουσες παθήσεις - επιπλοκές;26540.0;12
Η40Μβ;Κίρρωση και αλκοολική ηπατίτιδα με σοβαρές ή μεσαίας βαρύτητας  συνυπάρχουσες παθήσεις - επιπλοκές;9650.0;5
Η40Χ;Κίρρωση και αλκοολική ηπατίτιδα χωρίς   συνυπάρχουσες παθήσεις - επιπλοκές;3660.0;2
Η41Μ;Κακοήθεια του ηπατοχολικού συστήματος και παγκρέατος με καταστροφικές  συνυπάρχουσες παθήσεις - επιπλοκές;19300.0;9
Η41Χ;Κακοήθεια του ηπατοχολικού συστήματος και παγκρέατος χωρίς καταστροφικές  συνυπάρχουσες παθήσεις - επιπλοκές;8720.0;4
Η42Μ;Διαταραχές παγκρέατος χωρίς κακοήθεια με καταστροφικές ή σοβαρές  συνυπάρχουσες παθήσεις - επιπλοκές;19380.0;8
Η42Χ;Διαταραχές παγκρέατος χωρίς κακοήθεια χωρίς καταστροφικές ή σοβαρές  συνυπάρχουσες παθήσεις - επιπλοκές;7080.0;3
Η43Μ;Διαταραχές ήπατος χωρίς κακοήθεια, Κύρωση, αλκοολική ηπατίτιδα με καταστροφικές ή σοβαρές  συνυπάρχουσες παθήσεις - επιπλοκές;18130.0;8
Η43Χ;Διαταραχές ήπατος χωρίς κακοήθεια, Κύρωση, αλκοολική ηπατίτιδα χωρίς καταστροφικές ή σοβαρές  συνυπάρχουσες παθήσεις - επιπλοκές;5210.0;2
Η44Μ;Δαταραχές των χοληφόρων με  συνυπάρχουσες παθήσεις - επιπλοκές;11980.0;6
Η44Χ;Δαταραχές των χοληφόρων με/ χωρίς  συνυπάρχουσες παθήσεις - επιπλοκές;4360.0;2
Μ01Μ;Αμφοτερόπλευρες/Πολλαπλές επεμβάσεις μεγάλων αρθρώσεων κάτω άκρων με αναθεώρηση ή με καταστροφικές  συνυπάρχουσες παθήσεις - επιπλοκές;140200.0;25
Μ01Χ;Αμφοτερόπλευρες/ Πολλαπλές επεμβάσεις μεγάλων αρθρώσεων κάτω άκρων χωρίς αναθεώρηση  χωρίς  καταστροφικές  συνυπάρχουσες παθήσεις - επιπλοκές;96060.0;7
Μ02Μ;Μεταφορά μικροαγγειούμενου ιστικού μοσχεύματος ή (Δερματικό μόσχευμα με καταστροφικές ή σοβαρές συνυπάρχουσες παθήσεις – επιπλοκές) εξαιρουμένης άκρας χείρας;91100.0;27
Μ02Χ;Δερματικό μόσχευμα (κρημνός) χωρίς καταστροφικές ή σοβαρές συνυπάρχουσες παθήσεις – επιπλοκές, εξαιρουμένης άκρας χείρας;34300.0;8
Μ03Μ;Αντικατάσταση ισχίου με καταστροφικές συνυπάρχουσες παθήσεις - επιπλοκές;63070.0;15
Μ03Χ;Αντικατάσταση ισχίου χωρίς  καταστροφικές συνυπάρχουσες παθήσεις - επιπλοκές;64110.0;7
Μ04Μ;Αντικατάσταση γόνατος με καταστροφικές ή σοβαρές συνυπάρχουσες παθήσεις - επιπλοκές;70420.0;9
Μ04Χ;Αντικατάσταση γόνατος χωρίς καταστροφικές ή σοβαρές συνυπάρχουσες παθήσεις - επιπλοκές;66110.0;6
Μ05Μ;Αντικατάσταση άλλων αρθρώσεων με καταστροφικές ή σοβαρές συνυπάρχουσες παθήσεις - επιπλοκές;77050.0;11
Μ05Χ;Αντικατάσταση άλλων αρθρώσεων χωρίς καταστροφικές ή σοβαρές  συνυπάρχουσες παθήσεις - επιπλοκές;61010.0;5
Μ06Α;Σπονδυλοδεσία με παραμόρφωση;199800.0;9
Μ07Α;Ακρωτηριασμός;52350.0;21
Μ08Μ;Λοιπές επεμβάσεις ισχίου και μηριαίου με καταστροφικές  συνυπάρχουσες παθήσεις - επιπλοκές;44490.0;17
Μ08Χ;Λοιπές επεμβάσεις ισχίου και μηριαίου χωρίς καταστροφικές  συνυπάρχουσες παθήσεις - επιπλοκές;30140.0;9
Μ09Μ;Σπονδυλοδεσία με καταστροφικές  συνυπάρχουσες παθήσεις - επιπλοκές;147200.0;18
Μ09Χ;Σπονδυλοδεσία χωρίς καταστροφικές  συνυπάρχουσες παθήσεις - επιπλοκές;97830.0;7
Μ10Μ;Λοιπές επεμβάσεις αυχένος-οσφύος - θώρακος με καταστροφικές ή σοβαρές  συνυπάρχουσες παθήσεις - επιπλοκές;33910.0;10
Μ10Χ;Λοιπές επεμβάσεις αυχένος-οσφύος - θώρακος χωρίς καταστροφικές ή σοβαρές  συνυπάρχουσες παθήσεις - επιπλοκές;19080.0;4
Μ11Α;Επεμβάσεις διατατικής επιμηκύνσεως άκρων;40450.0;4
Μ12Μα;Λοίμωξη / φλεγμονή οστών και αρθρώσεων με διάφορες μυοσκελετικές επεμβάσεις με  σοβαρής και μέτριας βαρύτητας συνυπάρχουσες παθήσεις - επιπλοκές;54780.0;24
Μ12Μβ;Λοίμωξη / φλεγμονή οστών και αρθρώσεων με διάφορες μυοσκελετικές επεμβάσεις με  καταστροφικές συνυπάρχουσες παθήσεις - επιπλοκές;29930.0;14
Μ12Χ;Λοίμωξη / φλεγμονή οστών και αρθρώσεων με διάφορες μυοσκελετικές επεμβάσεις χωρίς  συνυπάρχουσες παθήσεις - επιπλοκές;16650.0;6
Μ13Μ;Επεμβάσεις βραχιονίου, κνήμης, περόνης και αστραγάλου με συνυπάρχουσες παθήσεις - επιπλοκές;38930.0;11
Μ13Χ;Επεμβάσεις Βραχιονίου, κνήμης, περόνης και αστραγάλου χωρίς συνυπάρχουσες παθήσεις - επιπλοκές;20830.0;4
Μ15Α;Κρανιοπροσωπικές επεμβάσεις;37610.0;6
Μ16Α;Λοιπές επεμβάσεις ώμου;15880.0;2
Μ17Μ;Γναθοπροσωπικές επεμβάσεις με συνυπάρχουσες παθήσεις - επιπλοκές;27080.0;3
Μ17Χ;Γναθοπροσωπικές επεμβάσεις χωρίς συνυπάρχουσες παθήσεις - επιπλοκές;17640.0;2
Μ18Α;Λοιπές επεμβάσεις γόνατος;7430.0;1
Μ19Μ;Λοιπές επεμβάσεις αγκώνος και αντιβραχίου με συνυπάρχουσες παθήσεις - επιπλοκές;26480.0;6
Μ19Χ;Λοιπές επεμβάσεις αγκώνος και αντιβραχίου χωρίς συνυπάρχουσες παθήσεις - επιπλοκές;19040.0;2
Μ20Α;Λοιπές επεμβάσεις άκρου ποδός;12860.0;2
Μ21Α;Τοπική Εκτομή και Αφαίρεση υλικών εσωτερικής οστεοσύνθεσης ισχίου και μηριαίου;10520.0;2
Μ23Α;Τοπική εκτομή και αφαίρεση υλικών εσωτερικής οστεοσύνθεσης εκτός ισχίου και μηριαίου;6610.0;1
Μ24Α;Αρθροσκόπηση;7100.0;1
Μ25Μ;Διαγνωστικές επεμβάσεις οστών και αρθρώσεων συμπεριλαμβανομένης βιοψίας  με συνυπάρχουσες παθήσεις - επιπλοκές;28640.0;11
Μ25Χ;Διαγνωστικές επεμβάσεις οστών και αρθρώσεων συμπεριλαμβανομένης βιοψίας χωρίς συνυπάρχουσες παθήσεις - επιπλοκές;12600.0;3
Μ27Μ;Επεμβάσεις μαλακών μορίων  με συνυπάρχουσες παθήσεις - επιπλοκές;21790.0;9
Μ27Χ;Επεμβάσεις μαλακών μορίων χωρίς συνυπάρχουσες παθήσεις - επιπλοκές;9020.0;2
Μ28Μ;Λοιπές επεμβάσεις μυοσκελετικού με συνυπάρχουσες παθήσεις - επιπλοκές;26390.0;11
Μ28Χ;Λοιπές επεμβάσεις μυοσκελετικού χωρίς συνυπάρχουσες παθήσεις - επιπλοκές;13790.0;2
Μ29Α;Ανακατασκευή ή αναθεώρηση πρόθεσης γόνατος;19030.0;1
Μ30Α;Επεμβάσεις χειρός;8910.0;1
Μ31Μ;Επανεπεμβαση Ισχίου με καταστροφικές  συνυπάρχουσες παθήσεις - επιπλοκές;116750.0;23
Μ31Χ;Επανεπεμβαση Ισχίου χωρίς καταστροφικές  συνυπάρχουσες παθήσεις - επιπλοκές;85330.0;11
Μ32Μα;Επανεπεμβαση γόνατος με καταστροφικές  συνυπάρχουσες παθήσεις - επιπλοκές;129120.0;27
Μ32Μβ;Επανεπεμβαση  γόνατος με  συνυπάρχουσες παθήσεις - επιπλοκές;99630.0;12
Μ32Χ;Επανεπεμβαση γόνατος χωρίς καταστροφικές η  συνυπάρχουσες παθήσεις - επιπλοκές;91470.0;9
Μ60Α;Κατάγματα διάφυσης μηριαίου;17200.0;7
Μ61Μ;Κατάγματα περιφερικού μηριαίου με συνυπάρχουσες παθήσεις - επιπλοκές;22100.0;13
Μ61Χ;Κατάγματα περιφερικού μηριαίου χωρίς συνυπάρχουσες παθήσεις - επιπλοκές;8560.0;4
Μ63Μ;Θλάσεις, διαστρέμματα και εξαρθρώματα Ισχίου, Λεκάνης και  Μηρού με συνυπάρχουσες παθήσεις - επιπλοκές;11980.0;7
Μ63Χ;Θλάσεις, διαστρέμματα και εξαρθρώματα Ισχίου, Λεκάνης και  Μηρού χωρίς συνυπάρχουσες παθήσεις - επιπλοκές;4440.0;2
Μ64Μ;Οστεομυελίτιδα με καταστροφικές ή σοβαρές συνυπάρχουσες παθήσεις - επιπλοκές;26690.0;15
Μ64Χ;Οστεομυελίτιδα χωρίς καταστροφικές ή σοβαρές συνυπάρχουσες παθήσεις - επιπλοκές;11750.0;8
Μ65Μ;Κακοήθεις νεοπλασματικοί  όγκοι μυοσκελετικού με καταστροφικές συνυπάρχουσες παθήσεις-επιπλοκές;25600.0;12
Μ65Χ;Κακοήθεις νεοπλασματικοί  όγκοι μυοσκελετικού χωρίς καταστροφικές συνυπάρχουσες παθήσεις-επιπλοκές;12220.0;5
Μ66Μ;Φλεγμονώδεις παθήσεις μυοσκελετικού με καταστροφικές  ή σοβαρές  συνυπάρχουσες παθήσεις - επιπλοκές;24360.0;10
Μ66Χ;Φλεγμονώδεις παθήσεις μυοσκελετικού χωρίς καταστροφικές  ή σοβαρές  συνυπάρχουσες παθήσεις - επιπλοκές;6520.0;2
Μ67Μ;Σηπτική αρθρίτιδα με καταστροφικές ή σοβαρές  συνυπάρχουσες παθήσεις - επιπλοκές;24280.0;12
Μ67Χ;Σηπτική αρθρίτιδα με καταστροφικές χωρίς σοβαρές  συνυπάρχουσες παθήσεις - επιπλοκές;9960.0;7
Μ68Μ;Μη χειρουργικές σκελετικές παθήσεις με συνυπάρχουσες παθήσεις - επιπλοκές;17120.0;9
Μ68Χ;Μη χειρουργικές παθήσεις νωτιαιου σωλήνα χωρίς συνυπάρχουσες παθήσεις - επιπλοκές;7310.0;4
Μ68Α;Μη χειρουργικές παθήσεις νωτιαιου σωλήνα μιας ημέρας θεραπειών;1510.0;1
Μ69Μ;Παθήσεις οστών και αρθροπάθειες με καταστροφικές ή σοβαρές  συνυπάρχουσες παθήσεις - επιπλοκές;15330.0;9
Μ69Χ;Παθήσεις οστών και αρθροπάθειες χωρίς καταστροφικές ή σοβαρές  συνυπάρχουσες παθήσεις - επιπλοκές;4280.0;2
Μ71Μ;Λοιπές παθήσεις μυών-τενόντων με καταστροφικές ή σοβαρές  συνυπάρχουσες παθήσεις - επιπλοκές;13230.0;7
Μ71Χ;Λοιπές παθήσεις μυών-τενόντων χωρίς καταστροφικές ή σοβαρές  συνυπάρχουσες παθήσεις - επιπλοκές;4050.0;2
Μ72Μ;Ειδικές παθήσεις μυών - τενόντων με καταστροφικές ή σοβαρές συνυπάρχουσες παθήσεις - επιπλοκές;16810.0;9
Μ72Χ;Ειδικές παθήσεις μυών - τενόντων χωρίς καταστροφικές  ή σοβαρές συνυπάρχουσες παθήσεις - επιπλοκές;4900.0;3
Μ73Μ;Μετεγχειρητική παρακολούθηση μυοσκελετικών μοσχευμάτων/ προθέσεων με καταστροφικές ή σοβαρές  συνυπάρχουσες παθήσεις - επιπλοκές;22490.0;18
Μ73Χ;Μετεγχειρητική παρακολούθηση μυοσκελετικών μοσχευμάτων/ προθέσεων χωρίς καταστροφικές ή σοβαρές  συνυπάρχουσες παθήσεις - επιπλοκές;5840.0;4
Μ74Α;Κακώσεις αντιβραχίου καρπού, χειρός ή ποδός;3500.0;2
Μ75Μ;Κάκωση ώμου, Βραχιονίου, αγκώνα, γόνατος, ποδιού ή αστραγάλου με συνυπάρχουσες παθήσεις - επιπλοκές;14550.0;8
Μ75Χ;Κάκωση ώμου, Βραχιονίου, αγκώνα, γόνατος, ποδιού ή αστραγάλου χωρίς συνυπάρχουσες παθήσεις - επιπλοκές;4050.0;2
Μ76Μ;Λοιπές μυοσκελετικές παθήσεις με καταστροφικές ή σοβαρές  συνυπάρχουσες παθήσεις - επιπλοκές;12920.0;7
Μ76Χ;Λοιπές μυοσκελετικές παθήσεις με καταστροφικές χωρίς  σοβαρές συνυπάρχουσες παθήσεις - επιπλοκές;3890.0;2
Μ77Μ;Κατάγματα λεκάνης με καταστροφικές ή σοβαρές  συνυπάρχουσες παθήσεις - επιπλοκές;22570.0;13
Μ77Χ;Κατάγματα λεκάνης με καταστροφικές χωρίς  σοβαρές συνυπάρχουσες παθήσεις - επιπλοκές;10580.0;6
Μ78Μ;Κατάγματα αυχένος του μηριαίου με καταστροφικές ή σοβαρές συνυπάρχουσες παθήσεις - επιπλοκές;14630.0;8
Μ78Χ;Κατάγματα αυχένος του μηριαίου χωρίς καταστροφικές η σοβαρές συνυπάρχουσες παθήσεις ή επιπλοκές;4750.0;2
Μ79Μ;Παθολογικά κατάγματα με καταστροφικές  συνυπάρχουσες παθήσεις - επιπλοκές;29420.0;17
Μ79Χ;Παθολογικά κατάγματα χωρίς καταστροφικές  συνυπάρχουσες παθήσεις - επιπλοκές;13700.0;8
Δ01Μ;Μεταφορά μικροαγγειακού μοσχεύματος για διαταραχές δέρματος, υποδορίου ιστού και μαστού με καταστροφικές/σοβαρές συνυπάρχουσες παθήσεις – επιπλοκές;85570.0;15
Δ01Χ;Μεταφορά μικροαγγειακού μοσχεύματος για διαταραχές δέρματος, υποδορίου ιστού και μαστού χωρίς καταστροφικές/σοβαρές συνυπάρχουσες παθήσεις – επιπλοκές;64520.0;9
Δ06Α;Μείζονες επεμβάσεις μαστού;13830.0;3
Δ07Α;Ελάσσονες  επεμβάσεις μαστού;6050.0;1
Δ08Μ;Άλλες επεμβάσεις για δερματικό μόσχευμα και/ ή χειρουργικός καθαρισμός με συνυπάρχουσες παθήσεις – επιπλοκές;22940.0;11
Δ08Χ;Άλλες επεμβάσεις για δερματικό μόσχευμα και/ ή χειρουργικός καθαρισμός χωρίς συνυπάρχουσες παθήσεις – επιπλοκές;7910.0;2
Δ09Α;Περιοδικές επεμβάσεις και επεμβάσεις τριχοφωλεακού συριγγίου;6880.0;2
Δ10Α;Χειρουργικές επεμβάσεις πλαστικής δέρματος, υποδορίου ιστού και μαστού;6720.0;1
Δ11Α;Άλλες χειρουργικές επεμβάσεις πλαστικής δέρματος, υποδορίου ιστού και μαστού;4040.0;1
Δ12Μ;Επεμβάσεις στα κάτω άκρα με έλκος/ κυτταρίτιδα, με καταστροφικές συνυπάρχουσες παθήσεις - επιπλοκές;48710.0;23
Δ12Χα;Επεμβάσεις στα κάτω άκρα με έλκος/ κυτταρίτιδα, χωρίς καταστροφικές συνυπάρχουσες παθήσεις - επιπλοκές με επιδιόρθωση με δερματικό μόσχευμα ή μεταφορά δερματικού κρημνού;30970.0;13
Δ12Χβ;Επεμβάσεις στα κάτω άκρα με έλκος/ κυτταρίτιδα χωρίς καταστροφικές συνυπάρχουσες παθήσεις - επιπλοκές χωρίς επιδιόρθωση με δερματικό μόσχευμα ή μεταφορά δερματικού κρημνού;17740.0;8
Δ13Μ;Επεμβάσεις στα κάτω άκρα χωρίς έλκος/ κυτταρίτιδα με καταστροφικές συνυπάρχουσες παθήσεις - επιπλοκές ή με επιδιόρθωση με δερματικό μόσχευμα ή μεταφορά δερματικού κρημνού;28560.0;12
Δ13Χ;Επεμβάσεις στα κάτω άκρα χωρίς έλκος/ κυτταρίτιδα χωρίς καταστροφικές συνυπάρχουσες παθήσεις - επιπλοκές, χωρίς επιδιόρθωση με δερματικό μόσχευμα ή μεταφορά δερματικού κρημνού;9150.0;4
Δ14Α;Εκτεταμένη πλαστική αποκατάσταση στήθους;41980.0;8
Δ20Μ;Δερματικά έλκη με καταστροφικές συνυπάρχουσες παθήσεις - επιπλοκές;26690.0;16
Δ20Χ;Δερματικά έλκη χωρίς καταστροφικές συνυπάρχουσες παθήσεις - επιπλοκές;14710.0;9
Δ20Α;Δερματικά έλκη, την ίδια ημέρα;1710.0;1
Δ22Μ;κακοήθεις παθήσεις του μαστου με συνυπάρχουσες παθήσεις - επιπλοκές;9650.0;5
Δ22Χ;κακοήθεις παθήσεις του μαστου χωρίς συνυπάρχουσες παθήσεις - επιπλοκές;6880.0;2
Δ23Μ;μη-κακοήθεις παθήσεις του μαστου με συνυπάρχουσες παθήσεις - επιπλοκές;9650.0;5
