DRG_code;description;cost;ALOS
Δ23Χ;μη-κακοήθεις παθήσεις του μαστου χωρίς συνυπάρχουσες παθήσεις - επιπλοκές;3660.0;2
Δ24Μ;Κυτταρίτιδα με καταστροφικές ή σοβαρές συνυπάρχουσες παθήσεις - επιπλοκές;16190.0;9
Δ24Χ;Κυτταρίτιδα χωρίς καταστροφικές ή σοβαρές συνυπάρχουσες παθήσεις - επιπλοκές;8020.0;4
Δ25Μ;Τραύμα στο δέρμα , υποδορίου και του μαστού με καταστ. η σοβαρές συνυπάρχουσες παθήσεις - επιπλοκές;11050.0;6
Δ25Χ;Τραύμα στο δέρμα , υποδορίου και του μαστού χωρίς καταστ. η σοβαρές συνυπάρχουσες παθήσεις - επιπλοκές;3500.0;2
Δ27Μ;Ελάσσονες παθήσεις του δέρματος;7080.0;3
Δ27Χ;Ελάσσονες παθήσεις του δέρματος την ίδια ημέρα;1990.0;1
Δ28Μ;Μείζονες παθήσεις με καταστροφικές η σοβαρές συνυπάρχουσες παθήσεις - επιπλοκές;19690.0;10
Δ28Χ;Μείζονες παθήσεις χωρίς καταστροφικές η σοβαρές συνυπάρχουσες παθήσεις - επιπλοκές;9650.0;4
Δ28Α;Μείζονες (μεγάλης βαρύτητας) παθήσεις την ίδια ημέρα;3820.0;1
Δ29Μ;Κακοήθειες του δέρματος με καταστροφικές συνυπάρχουσες παθήσεις - επιπλοκές;21710.0;11
Δ29Χ;Κακοήθειες του δέρματος χωρίς καταστροφικές συνυπάρχουσες παθήσεις - επιπλοκές;13770.0;7
Δ29Α;Κακοήθειες του δέρματος την ίδια ημέρα;1610.0;1
Θ01Μ;Διαβητικες επιπλοκές με καταστροφικές συνυπάρχουσες παθήσεις - επιπλοκές;62020.0;27
Θ01Χ;Διαβητικες επιπλοκες χωρίς καταστροφικές συνυπάρχουσες παθήσεις - επιπλοκές;28010.0;12
Θ02Μ;Επεμβάσεις υποφύσεως με συνυπάρχουσες παθήσεις - επιπλοκές;51350.0;10
Θ02Χ;Επεμβάσεις υποφύσεως χωρίς συνυπάρχουσες παθήσεις - επιπλοκές;35150.0;6
Θ03Α;Επεμβάσεις επινεφριδίου;32970.0;6
Θ04Μ;Μείζονες ( εξαιρετικά βαριές ) Επεμβασεις για την Παχυσαρκια με συνυπάρχουσες παθήσεις - επιπλοκές;43780.0;8
Θ04Χ;Μείζονες ( εξαιρετικά βαριές ) Επεμβασεις για την Παχυσαρκια χωρίς συνυπάρχουσες παθήσεις - επιπλοκές;28480.0;2
Θ05Μ;Επεμβάσεις παραθυρεοειδών με καταστροφικές ή σοβαρές συνυπάρχουσες παθήσεις - επιπλοκές;25870.0;8
Θ05Χ;Επεμβάσεις παραθυρεοειδών χωρίς καταστροφικές ή σοβαρές συνυπάρχουσες παθήσεις - επιπλοκές;12180.0;2
Θ06Μ;Επεμβάσεις του θυρεοειδούς με καταστροφικές η σοβαρές συνυπάρχουσες παθήσεις - επιπλοκές;26200.0;5
Θ06Χ;Επεμβάσεις του θυρεοειδούς χωρίς καταστροφικές η σοβαρές συνυπάρχουσες παθήσεις - επιπλοκές;15810.0;2
Θ07Α;Επεμβάσεις για την παχυσαρκία;12760.0;3
Θ08Α;Επεμβάσεις θυρεογλωσσικές;9520.0;1
Θ09Μ;Λοιπές χειρουργικές επεμβάσεις για  ενδοκρινολογικές, διατροφικές και μεταβολικές διαταραχές με καταστροφικές συνυπάρχουσες παθήσεις - επιπλοκές;48950.0;19
Θ09Χα;Λοιπές χειρουργικές επεμβάσεις για  ενδοκρινολογικές, διατροφικές και μεταβολικές διαταραχές χωρίς καταστροφικές συνυπάρχουσες παθήσεις - επιπλοκές;20800.0;7
Θ09Χβ;Άλλες Ενδοκρινολογικές, θρεπτικών και μεταβολικές επεμβάσεις χωρίς σοβαρές και μετριοπαθή  συνυπάρχουσες παθήσεις - επιπλοκές;17650.0;3
Θ20Α;Ενδοσκοπικές ή διερευνητικές επεμβάσεις για μεταβολικές δυσλειτουργίες την ίδια ημέρα;2970.0;1
Θ20Μ;Διαβήτης με καταστροφικές η σοβαρές συνυπάρχουσες παθήσεις - επιπλοκές;17350.0;8
Θ20Χ;Διαβήτης χωρίς καταστροφικές ή σοβαρές συνυπάρχουσες παθήσεις - επιπλοκές;7310.0;3
Θ21Α;Σοβαρές διατροφικές διαταραχές;25990.0;12
Θ22Μ;Διάφορες δυσλειτουργίες του μεταβολισμού με καταστροφικές  ή σοβαρές συνυπάρχουσες παθήσεις - επιπλοκές;13930.0;7
Θ22Χ;Διάφορες δυσλειτουργίες του μεταβολισμού χωρίς καταστροφικές ή σοβαρές συνυπάρχουσες παθήσεις - επιπλοκές;4820.0;2
Θ23Μ;Συγγενή ασθένειες του μεταβολισμού με συνυπάρχουσες παθήσεις - επιπλοκές;10740.0;4
Θ23Χ;Συγγενή ασθένειες του μεταβολισμού χωρίς συνυπάρχουσες παθήσεις - επιπλοκές;4050.0;2
Θ24Μ;Ενδοκρινολογικές δυσλειτουργίες με καταστροφικές η σοβαρές συνυπάρχουσες παθήσεις - επιπλοκές;18290.0;9
Θ24Χ;Ενδοκρινολογικές δυσλειτουργίες χωρίς καταστροφικές η σοβαρές συνυπάρχουσες παθήσεις - επιπλοκές;6690.0;2
Υ02Μ;Επέμβαση τοποθέτησης εισαγωγής καθετήρα περιτοναϊκής κάθαρσης με καταστροφικές ή σοβαρές συνυπάρχουσες παθήσεις – επιπλοκές;31110.0;10
Υ02Χ;Επέμβαση τοποθέτησης εισαγωγής καθετήρα περιτοναϊκής κάθαρσης χωρίς καταστροφικές ή σοβαρές συνυπάρχουσες παθήσεις – επιπλοκές;11890.0;2
Υ03Μα;Επεμβάσεις νεφρού, ουρητήρα και μεγάλες επεμβάσεις ουροδόχου κύστης για νεοπλασία με καταστροφικές συνυπάρχουσες παθήσεις – επιπλοκές;64310.0;15
Υ03Μβ;Επεμβάσεις νεφρού, ουρητήρα και μεγάλες επεμβάσεις ουροδόχου κύστης για νεοπλασία με σοβαρές συνυπάρχουσες παθήσεις – επιπλοκές;44260.0;9
Υ03Χ;Επεμβάσεις νεφρού, ουρητήρα και μεγάλες επεμβάσεις ουροδόχου κύστης για νεοπλασία χωρίς καταστροφικές ή σοβαρές συνυπάρχουσες παθήσεις – επιπλοκές;29920.0;5
Υ04Μ;Επεμβάσεις νεφρού, ουρητήρα και μεγάλες επεμβάσεις ουροδόχου κύστης για μη-νεοπλασία με καταστροφικές συνυπάρχουσες παθήσεις – επιπλοκές;43550.0;15
Υ04Χα;Επεμβάσεις νεφρού, ουρητήρα και μεγάλες επεμβάσεις ουροδόχου κύστης για μη-νεοπλασία με σοβαρές συνυπάρχουσες παθήσεις – επιπλοκές;23610.0;7
Υ04Χβ;Επεμβάσεις νεφρού, ουρητήρα και μεγάλες επεμβάσεις ουροδόχου κύστης για μη-νεοπλασία χωρίς καταστροφικές ή σοβαρές συνυπάρχουσες παθήσεις – επιπλοκές;16050.0;3
Υ05Μ;Διουρηθρική προστατεκτομή με καταστροφικές ή σοβαρές συνυπάρχουσες παθήσεις – επιπλοκές;28480.0;11
Υ05Χ;Διουρηθρική προστατεκτομή χωρίς καταστροφικές ή σοβαρές συνυπάρχουσες παθήσεις – επιπλοκές;10000.0;3
Υ06Μ;Μικρές επεμβάσεις Ουροδοχου κυστεως με καταστροφικές ή σοβαρές συνυπάρχουσες παθήσεις – επιπλοκές;23810.0;9
Υ06Χ;Μικρές επεμβάσεις Ουροδοχου κυστεως χωρίς  καταστροφικές ή σοβαρές συνυπάρχουσες παθήσεις – επιπλοκές;8080.0;2
Υ07Μ;Διουρηθρικές επεμβάσεις εκτός προστατεκτομικές με καταστροφικές ή σοβαρές συνυπάρχουσες παθήσεις – επιπλοκές;12180.0;5
Υ07Χ;Διουρηθρικές επεμβάσεις εκτός προστατεκτομικές χωρίς καταστροφικές ή σοβαρές συνυπάρχουσες παθήσεις – επιπλοκές;6800.0;1
Υ08Μ;Επεμβάσεις ουρήθρας με  συνυπάρχουσες παθήσεις – επιπλοκές;12710.0;5
Υ08Χ;Επεμβάσεις ουρήθρας χωρίς συνυπάρχουσες παθήσεις – επιπλοκές;6310.0;2
Υ09Μ;Άλλες επεμβάσεις για δυσλειτουργία νεφρού και ουροποιητικού συστήματος με καταστροφικές ή σοβαρές συνυπάρχουσες παθήσεις – επιπλοκές;47290.0;17
Υ09Χα;Άλλες επεμβάσεις για δυσλειτουργία νεφρού και ουροποιητικού συστήματος χωρίς καταστροφικές ή σοβαρές συνυπάρχουσες παθήσεις – επιπλοκές;19190.0;4
Υ09Χβ;Άλλες επεμβάσεις στα νεφρά και το ουροποιητικό σύστημα χωρίς καταστροφικές συνυπάρχουσες παθήσεις - επιπλοκές;10350.0;2
Υ20Α;Ουρηθροσκόπηση;7670.0;2
Υ22Α;Εξωσωματική λιθοτριψία για λίθους του ουροποιητικού;4820.0;1
Υ20Μα;Νεφρική ανεπάρκεια με  καταστροφικές συνυπάρχουσες παθήσεις – επιπλοκές;29340.0;12
Υ20Μβ;Νεφρική ανεπάρκεια με  σοβαρές συνυπάρχουσες παθήσεις – επιπλοκές;13000.0;6
Υ20Χ;Νεφρική ανεπάρκεια χωρίς καταστροφικές ή σοβαρές συνυπάρχουσες παθήσεις – επιπλοκές;5840.0;3
Υ21Α;Αιμοκάθαρση;1360.0;1
Υ22Μ;Νεοπλάσματα νεφρού και ουροποιητικού με καταστροφικές ή σοβαρές συνυπάρχουσες παθήσεις – επιπλοκές;14710.0;7
Υ22Χ;Νεοπλάσματα νεφρού και ουροποιητικού χωρίς καταστροφικές ή σοβαρές συνυπάρχουσες παθήσεις – επιπλοκές;5450.0;2
Υ23Μ;Λοιμώξεις νεφρού και ουροποιητικού με καταστροφικές ή σοβαρές συνυπάρχουσες παθήσεις – επιπλοκές;15640.0;8
Υ23Χ;Λοιμώξεις νεφρού και ουροποιητικού χωρίς καταστροφικές ή σοβαρές συνυπάρχουσες παθήσεις – επιπλοκές;5600.0;3
Υ24Α;Λιθίαση ουροποιητικού και απόφραξη;3890.0;2
Υ25Μ;Συμπτώματα και σημεία των νεφρών και του ουροποιητικού συστήματος με καταστροφικές ή σοβαρές συνυπάρχουσες παθήσεις - επιπλοκές;11280.0;6
Υ25Χ;Συμπτώματα και σημεία των νεφρών και του ουροποιητικού συστήματος χωρίς καταστροφικές ή σοβαρές συνυπάρχουσες παθήσεις - επιπλοκές;4050.0;2
Υ26Α;Στενώματα ουρήθρας;4400.0;2
Υ27Μ;Λοιπές διαγνώσεις των νεφρών και του ουροποιητικού συστήματος με καταστροφικές ή σοβαρές συνυπάρχουσες παθήσεις - επιπλοκές;16730.0;7
Υ27Χ;Λοιπές διαγνώσεις των νεφρών και του ουροποιητικού συστήματος χωρίς καταστροφικές ή σοβαρές συνυπάρχουσες παθήσεις - επιπλοκές;3580.0;2
Υ28Α;Περιτοναϊκή κάθαρση;2960.0;1
Β01Μ;Μείζονες ανδρικές πυελικές επεμβάσεις με καταστροφικές ή σοβαρές συνυπάρχουσες παθήσεις – επιπλοκές;35530.0;8
Β01Χ;Μείζονες ανδρικές πυελικές επεμβάσεις χωρίς  καταστροφικές ή σοβαρές συνυπάρχουσες παθήσεις – επιπλοκές;28920.0;4
Β02Μ;Διουρηθρική προστατεκτομή με καταστροφικές ή σοβαρές συνυπάρχουσες επιπλοκές;17190.0;7
Β02Χ;Διουρηθρική προστατεκτομή χωρίς καταστροφικές ή σοβαρές συνυπάρχουσες επιπλοκές;10070.0;3
Β03Α;Επεμβάσεις Πέους;7710.0;2
Β04Α;Επεμβάσεις όρχεων;6520.0;1
Β05Α;Περιτομή;4580.0;1
Β06Μ;Λοιπές χειρουργικές επεμβάσεις αντρικού αναπαραγωγικού συστήματος με καταστροφικές συνυπάρχουσες παθήσεις - επιπλοκές;19300.0;6
Β06Χ;Λοιπές χειρουργικές επεμβάσεις αντρικού αναπαραγωγικού συστήματος χωρίς καταστροφικές συνυπάρχουσες παθήσεις - επιπλοκές;16590.0;2
Β10Α;Κυστεοσκόπηση, την ίδια ημέρα;2200.0;1
Β20Μ;Κακοήθεια του αντρικού αναπαραγωγικού συστήματος με καταστροφικές ή σοβαρές συνυπάρχουσες παθήσεις - επιπλοκές;13230.0;7
Β20Χ;Κακοήθεια του αντρικού αναπαραγωγικού συστήματος χωρίς καταστροφικές ή σοβαρές συνυπάρχουσες παθήσεις - επιπλοκές;4130.0;2
Β21Α;Καλοήθης υπερτροφία προστάτη;4590.0;2
Β22Α;Φλεγμονή του αντρικού αναπαραγωγικού συστήματος;5450.0;3
Β23Α;Αντρική στείρωση;3160.0;1
Β24Α;Άλλη διάγνωση αντρικού αναπαραγωγικού συστήματος;2960.0;1
Γ01Α;Πυελική εξπλάχνιση και ριζική βουλβεκτομή;29640.0;8
Γ04Μ;Υστερεκτομή για μη κακοήθεια με καταστροφικές ή σοβαρές συνυπάρχουσες παθήσεις - επιπλοκές;20620.0;5
Γ04Χ;Υστερεκτομή για μη κακοήθεια χωρίς καταστροφικές ή σοβαρές συνυπάρχουσες παθήσεις - επιπλοκές;15250.0;3
Γ05Μ;Χειρουργική αφαίρεση ωοθηκών και σαλπίγγων για μη κακοήθεια με καταστροφικές ή σοβαρές συνυπάρχουσες παθήσεις - επιπλοκές;21470.0;6
Γ05Χ;Χειρουργική αφαίρεση ωοθηκών και σαλπίγγων για μη κακοήθεια χωρίς καταστροφικές ή σοβαρές συνυπάρχουσες παθήσεις - επιπλοκές;13740.0;2
Γ06Μ;Επανορθωτική επέμβαση γυναικείου αναπαραγωγικού συστήματος με καταστροφικές ή σοβαρές συνυπάρχουσες παθήσεις - επιπλοκές;16490.0;4
Γ06Χ;Επανορθωτική επέμβαση γυναικείου αναπαραγωγικού συστήματος χωρίς καταστροφικές ή σοβαρές συνυπάρχουσες παθήσεις - επιπλοκές;12640.0;2
Γ07Α;Λοιπές επεμβάσεις μήτρας και εξαρτημάτων για μη κακοήθεια;7420.0;1
Γ08Α;Ενδοσκοπικές και λαπαροσκοπικές Επεμβάσεις στο γυναικείο αναπαραγωγικό σύστημα;7190.0;1
Γ09Α;Επεμβάσεις αΐδιου, τραχήλου και κόλπου;4180.0;2
Γ10Α;Διαγνωστική υστεροσκόπηση απόξεση;4250.0;1
Γ11Α;Άλλες επεμβάσεις στο γυναικείο αναπαραγωγικό σύστημα;7290.0;3
Γ12Μ;Επέμβαση για κακοήθεια μήτρας και δευτερευόντων οργάνων με καταστροφικές συνυπάρχουσες παθήσεις - επιπλοκές;35760.0;9
Γ12Χ;Επέμβαση για κακοήθεια μήτρας και δευτερευόντων οργάνων χωρίς καταστροφικές συνυπάρχουσες παθήσεις - επιπλοκές;19630.0;4
Γ20Μ;Κακοήθεια γυναικείου αναπαραγωγικού συστήματος με καταστροφικές συνυπάρχουσες παθήσεις - επιπλοκές;19690.0;9
Γ20Χ;Κακοήθεια γυναικείου αναπαραγωγικού συστήματος χωρίς καταστροφικές συνυπάρχουσες παθήσεις - επιπλοκές;7550.0;3
Γ21Α;Λοιμώξεις του γυναικείου αναπαραγωγικού συστήματος;4750.0;2
Γ22Α;Διαταραχές εμμήνου ρύσεως και άλλες διαταραχές του γυναικείου αναπαραγωγικού συστήματος;2570.0;1
Λ01Μ;Τοκετός με καισαρική τομή με καταστροφικές ή σοβαρές συνυπάρχουσες παθήσεις - επιπλοκές;21710.0;7
Λ01Χ;Τοκετός με καισαρική τομή χωρίς καταστροφικές ή σοβαρές συνυπάρχουσες παθήσεις - επιπλοκές;15410.0;4
Λ02Μ;Κολπικός τοκετός με παρέμβαση στο χειρουργείο με καταστροφικές ή σοβαρές συνυπάρχουσες παθήσεις - επιπλοκές;17430.0;4
Λ02Χ;Κολπικός τοκετός με επέμβαση στο χειρουργείο χωρίς καταστροφικές ή σοβαρές συνυπάρχουσες παθήσεις - επιπλοκές;11750.0;3
Λ03Μ;Έκτοπη κύηση με καταστροφικές συνυπάρχουσες παθήσεις - επιπλοκές;12490.0;3
Λ03Χ;Έκτοπη κύηση χωρίς καταστροφικές συνυπάρχουσες παθήσεις - επιπλοκές;8860.0;2
Λ04Μ;Επέμβαση στο χειρουργείο μετά τον τοκετό ή μετά την άμβλωση  με καταστροφικές ή σοβαρές συνυπάρχουσες παθήσεις - επιπλοκές;18070.0;5
Λ04Χ;Επέμβαση σο χειρουργείο μετά τον τοκετό ή μετά την άμβλωση  χωρίς καταστροφικές ή σοβαρές συνυπάρχουσες παθήσεις - επιπλοκές;5710.0;2
Λ05Α;Άμβλωση με χειρουργική επέμβαση;3340.0;1
Λ20Α;Κολπικός τοκετός;8720.0;3
Λ21Α;Μετά τοκετός άμβλωση χωρίς χειρουργική επέμβαση;4200.0;2
Λ23Α;Άμβλωση χωρίς επέμβαση στο χειρουργείο;2650.0;1
Λ24Α;Αποβολή;2880.0;2
Λ26Α;Προγεννητική και άλλη μαιευτική εισαγωγή;2570.0;2
Τ01Α;Νεογνά που κατέληξαν ή διακομίστηκαν σε <5 ημέρες από την εισαγωγή με σημαντικές χειρουργικές επεμβάσεις;13810.0;1
Τ02Α;Καρδιοθωρακική / αγγειοχειρουργική επέμβαση σε νεογνά;202790.0;23
Τ03Α;Σημαντική χειρουργική επέμβαση σε νεογνά με βάρος εισαγωγής 1000-1499 gr;168460.0;48
Τ04Α;Σημαντική χειρουργική επέμβαση σε νεογνά με βάρος εισαγωγής 1500 1999 gr;119970.0;34
Τ05Α;Σημαντική χειρουργική επέμβαση σε νεογνά με βάρος εισαγωγής 2000-2499 gr;103570.0;27
Τ06Μ;Σημαντική χειρουργική επέμβαση σε νεογνά με βάρος εισαγωγής >2499  gr με πολλαπλά σοβαρά προβλήματα;151280.0;30
Τ06Χ;Σημαντική χειρουργική επέμβαση σε νεογνά με βάρος εισαγωγής >2499  gr χωρίς πολλαπλά σοβαρά προβλήματα;50620.0;13
Τ20Μ;Νεογνά που κατέληξαν ή διακομίστηκαν σε <5 ημέρες από την εισαγωγή χωρίς σημαντική χειρουργική επέμβαση, νεογέννητα;2440.0;2
Τ20Χ;Νεογνά που κατέληξαν ή διακομίστηκαν σε <5 ημέρες από την εισαγωγή χωρίς σημαντική χειρουργική επέμβαση εκτός νεογέννητων;5120.0;2
Τ21Α;Νεογνά με βάρος εισαγωγής <750 gr;415790.0;73
Τ22Α;Νεογνά με βάρος εισαγωγής 750-999 gr;307250.0;65
Τ23Α;Νεογνά με βάρος εισαγωγής 1000-1249 gr χωρίς σημαντική χειρουργική επέμβαση;73590.0;25
Τ24Α;Νεογνά με βάρος εισαγωγής 1250 -1499 gr χωρίς σημαντική  χειρουργική επέμβαση;58180.0;26
Τ25Μα;Νεογνά με βάρος εισαγωγής 1500 - 1999 gr χωρίς σημαντική  χειρουργική επέμβαση με πολλαπλά μείζονα προβλήματα;58720.0;24
Τ25Μβ;Νεογνά με βάρος εισαγωγής 1500 - 1999 gr χωρίς σημαντική χειρουργική επέμβαση με σημαντικά προβλήματα;41450.0;20
Τ25Μγ;Νεογνά με βάρος εισαγωγής 1500 - 1999 gr χωρίς σημαντική χειρουργική επέμβαση με άλλα προβλήματα;31580.0;18
Τ25Χ;Νεογνά με βάρος εισαγωγής 1500 - 1999 gr χωρίς σημαντική  χειρουργική επέμβαση χωρίς προβλήματα;26460.0;15
Τ26Μα;Νεογνά με βάρος εισαγωγής 2000 - 2499  gr χωρίς σημαντική χειρουργική επέμβαση με πολλαπλά προβλήματα;37190.0;15
Τ26Μβ;Νεογνά με βάρος εισαγωγής 2000 - 2499  gr χωρίς σημαντική χειρουργική επέμβαση σημαντικά προβλήματα;23460.0;12
Τ26Μγ;Νεογνά με βάρος εισαγωγής 2000 - 2499  gr χωρίς σημαντική χειρουργική επέμβαση με λοιπά προβλήματα;16440.0;11
Τ26Χ;Νεογνά με βάρος εισαγωγής 2000 - 2499  gr χωρίς σημαντική χειρουργική επέμβαση χωρίς προβλήματα;7160.0;5
Τ27Μα;Νεογνά με βάρος εισαγωγής  >2499  gr χωρίς σημαντική χειρουργική επέμβαση πολλαπλά μείζονα προβλήματα;30760.0;12
Τ27Μβ;Νεογνά με βάρος εισαγωγής >2499  gr χωρίς σημαντική χειρουργική επέμβαση σημαντικά προβλήματα;12940.0;7
Τ27Μγ;Νεογνά με βάρος εισαγωγής >2499  gr χωρίς σημαντική χειρουργική επέμβαση λοιπά προβλήματα;9180.0;5
Τ27Χ;Νεογνά με βάρος εισαγωγής >2499  gr χωρίς σημαντική χειρουργική επέμβαση χωρίς προβλήματα;4280.0;3
Ξ01Α;Σπληνεκτομή;34760.0;7
Ξ02Μ;Λοιπές χειρουργικές επεμβάσεις αίματος και αιμοποιητικών οργάνων με καταστροφικές ή σοβαρές συνυπάρχουσες παθήσεις - επιπλοκές;46550.0;13
